{
  "schema_version": "codex-scope.regressions.v2",
  "evidence_date": "2026-10-26",
  "upstream": {
    "repository": "openai/codex",
    "current_commit": "970111f6cb62cc02fe36a82ea7d71b37a2889c97"
  },
  "cases": [
    {
      "regression_id": "codex-config-home-project-layer-exclusion",
      "rule_id": "codex.config.codex_home_project_layer_exclusion",
      "kind": "upstream_fix",
      "upstream_repository": "openai/codex",
      "upstream_commit": "dd6c1d3787aa3c8032f6e6496e2bf25c47ddb37a",
      "upstream_date": "2026-01-30",
      "historical_behavior": "Before openai/codex #10207, CODEX_HOME could be rediscovered and loaded as a project .codex layer, duplicating the same config source.",
      "current_behavior": "Since commit dd6c1d3787aa3c8032f6e6496e2bf25c47ddb37a, project-layer traversal skips CODEX_HOME using absolute and best-effort canonical path identity.",
      "why_regression_case": "A resolver that double-loads CODEX_HOME can change precedence, trust warnings, and provenance.",
      "evidence": [
        "https://github.com/openai/codex/issues/9932",
        "https://github.com/openai/codex/commit/dd6c1d3787aa3c8032f6e6496e2bf25c47ddb37a"
      ],
      "expected_result": "compatible",
      "compatibility_classification": "compatible",
      "current_implementation_expected_outcome": "compatible",
      "test_binding": {
        "runner": "scripts/conformance-check.mjs",
        "fixture_path": "fixtures/config/codex-home-project",
        "assertion_count": 3,
        "coverage": "full_supported_boundary",
        "limitation": null
      }
    },
    {
      "regression_id": "codex-agents-home-project-root-duplication",
      "rule_id": "codex.instructions.codex_home_project_root_duplication",
      "kind": "current_upstream_discrepancy",
      "upstream_repository": "openai/codex",
      "upstream_commit": "94174e44cbc54cece45f6052328ca0c2cd7a8a2a",
      "upstream_date": "2026-09-22",
      "historical_behavior": "codex-cli 0.144.6 reproduction in openai/codex #34193 showed one canonical AGENTS.md contributing once as global instructions and again as project instructions.",
      "current_behavior": "The issue remains open and current source at 94174e44cbc54cece45f6052328ca0c2cd7a8a2a still assembles user instructions separately from project-discovered entries without cross-source canonical-path deduplication.",
      "why_regression_case": "Codex Scope must track current implementation parity without treating the duplication as desired semantics; an upstream fix should intentionally flip this fixture.",
      "evidence": [
        "https://github.com/openai/codex/issues/34193",
        "https://github.com/openai/codex/blob/94174e44cbc54cece45f6052328ca0c2cd7a8a2a/codex-rs/core/src/agents_md.rs",
        "https://github.com/openai/codex/blob/94174e44cbc54cece45f6052328ca0c2cd7a8a2a/codex-rs/codex-home/src/instructions/mod.rs"
      ],
      "expected_result": "compatible",
      "compatibility_classification": "compatible",
      "current_implementation_expected_outcome": "compatible",
      "test_binding": {
        "runner": "scripts/conformance-check.mjs",
        "fixture_path": "fixtures/real-world/codex-34193/home-project",
        "assertion_count": 2,
        "coverage": "full_supported_boundary",
        "limitation": null
      }
    },
    {
      "regression_id": "codex-profile-v2-file-selection",
      "rule_id": "codex.config.profile_precedence",
      "kind": "upstream_behavior_change",
      "upstream_repository": "openai/codex",
      "upstream_commit": "8a511d5881e9e8c449aeb53b471170111f859e48",
      "upstream_date": "2026-05-21",
      "historical_behavior": "Older Codex profile selection used legacy profile tables in config.toml.",
      "current_behavior": "Official documentation states that as of Codex 0.134.0, --profile selects a separate CODEX_HOME/<name>.config.toml file and no longer reads the legacy [profiles.<name>] table.",
      "why_regression_case": "Reintroducing legacy table selection would silently change the effective layer stack and violate the current profile-v2 boundary.",
      "evidence": [
        "https://github.com/openai/codex/commit/8a511d5881e9e8c449aeb53b471170111f859e48",
        "https://developers.openai.com/codex/config-file/config-advanced",
        "https://github.com/openai/codex/blob/94174e44cbc54cece45f6052328ca0c2cd7a8a2a/codex-rs/protocol/src/config_types.rs"
      ],
      "expected_result": "compatible",
      "compatibility_classification": "compatible",
      "current_implementation_expected_outcome": "compatible",
      "test_binding": {
        "runner": "scripts/conformance-check.mjs",
        "fixture_path": "fixtures/config/layering",
        "assertion_count": 2,
        "coverage": "full_supported_boundary",
        "limitation": null
      }
    },
    {
      "regression_id": "codex-approval-policy-untrusted-removed",
      "rule_id": "codex.config.approval_policy_untrusted_removed",
      "kind": "upstream_semantic_change",
      "upstream_repository": "openai/codex",
      "upstream_commit": "942af8447b1d1addc81fb3c3135293497d479a06",
      "upstream_date": "2026-08-20",
      "historical_behavior": "The legacy approval_policy=\"untrusted\" value existed in older Codex semantics and Codex Scope previously classified it as supported.",
      "current_behavior": "Current official Codex documentation says approval_policy=\"untrusted\" is no longer supported; trust is configured separately.",
      "why_regression_case": "Continuing to report the historical value as resolved current semantics is false certainty and can mislead compatibility checks.",
      "evidence": [
        "https://github.com/openai/codex/commit/942af8447b1d1addc81fb3c3135293497d479a06",
        "https://developers.openai.com/codex/config-file/config-reference",
        "https://developers.openai.com/codex/security",
        "https://github.com/openai/codex/blob/94174e44cbc54cece45f6052328ca0c2cd7a8a2a/codex-rs/core/config.schema.json"
      ],
      "expected_result": "unsupported",
      "compatibility_classification": "unsupported",
      "current_implementation_expected_outcome": "unsupported",
      "test_binding": {
        "runner": "scripts/conformance-check.mjs",
        "fixture_path": "fixtures/config/policy-legacy",
        "assertion_count": 2,
        "coverage": "full_supported_boundary",
        "limitation": null
      }
    },
    {
      "regression_id": "codex-project-doc-budget-shared-across-environments",
      "rule_id": "codex.instructions.cumulative_byte_limit",
      "kind": "upstream_semantic_change",
      "upstream_repository": "openai/codex",
      "upstream_commit": "85e0661c3baacc62db7b006d2b8085b006d0795e",
      "upstream_date": "2026-08-07",
      "historical_behavior": "Before openai/codex commit 85e0661c3baacc62db7b006d2b8085b006d0795e, project_doc_max_bytes was applied independently to each selected environment, so total project instruction bytes could grow by one full budget per environment.",
      "current_behavior": "Since commit 85e0661c3baacc62db7b006d2b8085b006d0795e, project_doc_max_bytes is one aggregate budget consumed in selected-environment order; the entry reaching the remaining limit is truncated and later environments are skipped once the budget is exhausted.",
      "why_regression_case": "Per-environment budgeting can exceed the current aggregate safety/semantic boundary. Codex Scope's local cumulative-byte fixture remains compatible for one environment, while multi-environment composition stays explicitly outside the supported deterministic resolver boundary.",
      "evidence": [
        "https://github.com/openai/codex/commit/85e0661c3baacc62db7b006d2b8085b006d0795e",
        "https://developers.openai.com/codex/config-file/config-reference"
      ],
      "expected_result": "unresolved",
      "compatibility_classification": "unresolved",
      "current_implementation_expected_outcome": "compatible",
      "test_binding": {
        "runner": "scripts/conformance-check.mjs",
        "fixture_path": "fixtures/agents/size-limit",
        "assertion_count": 3,
        "coverage": "partial_supported_boundary",
        "limitation": "The deterministic local fixture guards the single-environment cumulative byte limit. Multi-environment instruction composition remains outside the supported resolver boundary, so the upstream aggregate-budget change is tracked as unresolved rather than simulated."
      }
    }
  ]
}
